{
  "schemaVersion": "2.0",
  "evaluationType": "BKL046_F5_REAL_EVIDENCE_EVALUATION",
  "evaluationState": "F5C_CLOSURE_EVALUATED",
  "identityMethod": "BKL046-F5-CANONICAL-JSON-SHA256-1",
  "evaluationId": "BKL046-F5C-CF76B1AD2279F17CA2A9302F",
  "generatedAt": "2026-10-17T06:07:46.480Z",
  "producer": "DSG.AiPostProcessingRealEvidenceEvaluator",
  "producerVersion": "2.0.0-f5c",
  "methodId": "BKL046-F5C-CLOSED-EVALUATION-1",
  "sourceSnapshots": {
    "catalog": {
      "path": "docs/data/scientific-session-catalog.json",
      "digest": "d429276b1fba459bfb5de02cbe76c9839a78481b7d509dfc42457d68a1c27cc8",
      "sessionCount": 26,
      "sessionIds": [
        "2026-07-14_2026-07-15",
        "2026-07-15_2026-07-16",
        "2026-07-16_2026-07-17",
        "2026-08-10_2026-08-11",
        "2026-08-14_2026-08-15",
        "2026-08-15_2026-08-16",
        "2026-08-26_2026-08-27",
        "2026-08-31_2026-09-01",
        "2026-09-01_2026-09-02",
        "2026-09-02_2026-09-03",
        "2026-09-03_2026-09-04",
        "2026-09-04_2026-09-05",
        "2026-09-05_2026-09-06",
        "2026-09-06_2026-09-07",
        "2026-09-07_2026-09-08",
        "2026-09-12_2026-09-13",
        "2026-09-13_2026-09-14",
        "2026-09-14_2026-09-15",
        "2026-09-15_2026-09-16",
        "2026-09-19_2026-09-20",
        "2026-09-21_2026-09-22",
        "2026-09-22_2026-09-23",
        "2026-10-13_2026-10-14",
        "2026-10-14_2026-10-15",
        "2026-10-15_2026-10-16",
        "2026-10-16_2026-10-17"
      ]
    },
    "f4Projection": {
      "path": "docs/data/ai-post-processing-advisory-projection.json",
      "digest": "b3766f04035bc85f92eefa3e8e6030971d7e240e4c06e474db9e550705023f1f",
      "projectionId": "BKL046-F4-DCAF3D333DCB010E8CC552AC",
      "generatedAt": "2026-10-17T06:07:46.337Z",
      "sourceSetDigest": "d0529a1abfe7d607991fc1b6172279bb49c28eaba51ebe03983dae05cc2de9dc",
      "recordCount": 26
    },
    "humanDecisionSourceSet": {
      "directory": "docs/data/ai-post-processing-human-decisions",
      "pathPattern": "^docs\\/data\\/ai-post-processing-human-decisions\\/BKL-046-F2-HDR-\\d{8}T\\d{6}Z-[A-Z0-9][A-Z0-9_-]{0,31}\\.json$",
      "validationMode": "RAW_BUILD_TIME_SANITIZED_PUBLIC_SNAPSHOT",
      "digest": "4f53cda18c2baa0c0354bb5f9a3ecbe5ed12ab4d8e11ba873c2f11161202b945",
      "entries": []
    },
    "executionEvidenceSourceSet": {
      "directory": "docs/data/ai-post-processing-execution-evidence",
      "pathPattern": "^docs\\/data\\/ai-post-processing-execution-evidence\\/BKL-046-F5-EXE-\\d{8}T\\d{6}Z-[A-Z0-9][A-Z0-9_-]{0,31}\\.json$",
      "validationMode": "RAW_BUILD_TIME_SANITIZED_PUBLIC_SNAPSHOT",
      "digest": "4f53cda18c2baa0c0354bb5f9a3ecbe5ed12ab4d8e11ba873c2f11161202b945",
      "entries": []
    }
  },
  "methodRegistry": {
    "registryId": "BKL046-F5C-CLOSED-REGISTRY-1",
    "cohortIds": [
      "ALL-CANONICAL-SESSIONS-F5",
      "EXACT-PROVENANCE-MATCHED-F5",
      "HUMAN-DECISION-RECEIPTS-F5",
      "EXECUTION-EVIDENCE-F5"
    ],
    "selectionRuleIds": [
      "ALL-CANONICAL-SESSIONS-EXACT-SET-1",
      "F4-PROVENANCE-MATCHED-EXACT-1",
      "F2-HUMAN-DECISION-EXACT-CORRELATION-1",
      "F5-EXECUTION-EVIDENCE-EXACT-CORRELATION-1"
    ],
    "technicalGateIds": [
      "CATALOG_SNAPSHOT_INTEGRITY",
      "F4_PROJECTION_INTEGRITY",
      "FULL_POPULATION_COVERAGE",
      "HUMAN_DECISION_SOURCE_CONTRACT",
      "EXECUTION_EVIDENCE_SOURCE_CONTRACT",
      "CLOSED_METHOD_REGISTRY",
      "F5A_REPORT_DETERMINISM",
      "F5B_DYNAMIC_UPDATE",
      "F5B_CONSUMER"
    ],
    "technicalStates": [
      "READY_FOR_F5_EVALUATION",
      "NOT_ACCEPTED",
      "REJECTED",
      "ACCEPTED_READ_ONLY_WITH_LIMITATIONS"
    ],
    "scientificStates": [
      "NOT_EVALUABLE_CURRENT_EVIDENCE",
      "EVALUATION_REQUIRED",
      "INVALID"
    ],
    "humanDecisionStates": [
      "NOT_AVAILABLE",
      "AVAILABLE"
    ],
    "productionStates": [
      "NOT_READY_FOR_PRODUCTION",
      "REJECTED_FOR_PRODUCTION"
    ],
    "capabilityOutcomes": [
      "F5A_EVALUATION_FOUNDATION_READY",
      "NOT_ACCEPTED",
      "REJECTED",
      "ACCEPTED_READ_ONLY_WITH_LIMITATIONS"
    ],
    "closureRecommendations": [
      "KEEP_OPEN",
      "DO_NOT_CLOSE",
      "CLOSE_DETERMINISTIC_CAPABILITY"
    ],
    "gateStates": [
      "PASS",
      "FAIL_CLOSED",
      "NOT_EXECUTED"
    ],
    "evidenceStates": [
      "AVAILABLE",
      "NOT_AVAILABLE",
      "NOT_EVALUABLE"
    ],
    "reasonCodes": [
      "FULL_CANONICAL_POPULATION",
      "NO_EXACT_PROVENANCE_MATCHES",
      "EXACT_PROVENANCE_AVAILABLE",
      "NO_HUMAN_DECISION_RECEIPTS",
      "HUMAN_DECISION_RECEIPTS_AVAILABLE",
      "NO_EXECUTION_EVIDENCE",
      "EXECUTION_EVIDENCE_AVAILABLE",
      "NO_APPROVED_GROUND_TRUTH_METHOD",
      "F5A_FOUNDATION_IMPLEMENTED",
      "F5B_DYNAMIC_UPDATE_VERIFIED",
      "F5B_CONSUMER_VERIFIED",
      "PRODUCTION_AUTHORITY_NOT_GRANTED",
      "SCIENTIFIC_EFFECTIVENESS_NOT_ESTABLISHED"
    ]
  },
  "cohorts": [
    {
      "cohortId": "ALL-CANONICAL-SESSIONS-F5",
      "selectionRuleId": "ALL-CANONICAL-SESSIONS-EXACT-SET-1",
      "populationCount": 26,
      "eligibleCount": 26,
      "memberRefs": [
        "2026-07-14_2026-07-15",
        "2026-07-15_2026-07-16",
        "2026-07-16_2026-07-17",
        "2026-08-10_2026-08-11",
        "2026-08-14_2026-08-15",
        "2026-08-15_2026-08-16",
        "2026-08-26_2026-08-27",
        "2026-08-31_2026-09-01",
        "2026-09-01_2026-09-02",
        "2026-09-02_2026-09-03",
        "2026-09-03_2026-09-04",
        "2026-09-04_2026-09-05",
        "2026-09-05_2026-09-06",
        "2026-09-06_2026-09-07",
        "2026-09-07_2026-09-08",
        "2026-09-12_2026-09-13",
        "2026-09-13_2026-09-14",
        "2026-09-14_2026-09-15",
        "2026-09-15_2026-09-16",
        "2026-09-19_2026-09-20",
        "2026-09-21_2026-09-22",
        "2026-09-22_2026-09-23",
        "2026-10-13_2026-10-14",
        "2026-10-14_2026-10-15",
        "2026-10-15_2026-10-16",
        "2026-10-16_2026-10-17"
      ],
      "evidenceState": "AVAILABLE",
      "reasonCodes": [
        "FULL_CANONICAL_POPULATION"
      ],
      "limitations": [
        "This cohort proves complete governed population coverage only; it is not scientific-effectiveness evidence."
      ]
    },
    {
      "cohortId": "EXACT-PROVENANCE-MATCHED-F5",
      "selectionRuleId": "F4-PROVENANCE-MATCHED-EXACT-1",
      "populationCount": 26,
      "eligibleCount": 0,
      "memberRefs": [],
      "evidenceState": "NOT_EVALUABLE",
      "reasonCodes": [
        "NO_EXACT_PROVENANCE_MATCHES"
      ],
      "limitations": [
        "Only exact F4/BKL-045 session correlation is eligible; similarity and imputation are forbidden."
      ]
    },
    {
      "cohortId": "HUMAN-DECISION-RECEIPTS-F5",
      "selectionRuleId": "F2-HUMAN-DECISION-EXACT-CORRELATION-1",
      "populationCount": 52,
      "eligibleCount": 0,
      "memberRefs": [],
      "evidenceState": "NOT_AVAILABLE",
      "reasonCodes": [
        "NO_HUMAN_DECISION_RECEIPTS"
      ],
      "limitations": [
        "Human disposition is not execution proof and is not scientific ground truth."
      ]
    },
    {
      "cohortId": "EXECUTION-EVIDENCE-F5",
      "selectionRuleId": "F5-EXECUTION-EVIDENCE-EXACT-CORRELATION-1",
      "populationCount": 0,
      "eligibleCount": 0,
      "memberRefs": [],
      "evidenceState": "NOT_AVAILABLE",
      "reasonCodes": [
        "NO_EXECUTION_EVIDENCE"
      ],
      "limitations": [
        "Execution evidence proves a governed manual execution link only; it does not prove outcome quality."
      ]
    }
  ],
  "technicalGates": [
    {
      "gateId": "CATALOG_SNAPSHOT_INTEGRITY",
      "state": "PASS",
      "reasonCodes": []
    },
    {
      "gateId": "F4_PROJECTION_INTEGRITY",
      "state": "PASS",
      "reasonCodes": []
    },
    {
      "gateId": "FULL_POPULATION_COVERAGE",
      "state": "PASS",
      "reasonCodes": []
    },
    {
      "gateId": "HUMAN_DECISION_SOURCE_CONTRACT",
      "state": "PASS",
      "reasonCodes": []
    },
    {
      "gateId": "EXECUTION_EVIDENCE_SOURCE_CONTRACT",
      "state": "PASS",
      "reasonCodes": []
    },
    {
      "gateId": "CLOSED_METHOD_REGISTRY",
      "state": "PASS",
      "reasonCodes": []
    },
    {
      "gateId": "F5A_REPORT_DETERMINISM",
      "state": "PASS",
      "reasonCodes": []
    },
    {
      "gateId": "F5B_DYNAMIC_UPDATE",
      "state": "PASS",
      "reasonCodes": []
    },
    {
      "gateId": "F5B_CONSUMER",
      "state": "PASS",
      "reasonCodes": []
    }
  ],
  "outcomes": {
    "technical": {
      "state": "ACCEPTED_READ_ONLY_WITH_LIMITATIONS",
      "reasonCodes": [
        "F5A_FOUNDATION_IMPLEMENTED",
        "F5B_CONSUMER_VERIFIED",
        "F5B_DYNAMIC_UPDATE_VERIFIED"
      ]
    },
    "scientific": {
      "state": "NOT_EVALUABLE_CURRENT_EVIDENCE",
      "reasonCodes": [
        "NO_APPROVED_GROUND_TRUTH_METHOD",
        "NO_EXACT_PROVENANCE_MATCHES"
      ]
    },
    "humanDecision": {
      "state": "NOT_AVAILABLE",
      "reasonCodes": [
        "NO_HUMAN_DECISION_RECEIPTS"
      ]
    },
    "production": {
      "state": "NOT_READY_FOR_PRODUCTION",
      "reasonCodes": [
        "PRODUCTION_AUTHORITY_NOT_GRANTED",
        "SCIENTIFIC_EFFECTIVENESS_NOT_ESTABLISHED"
      ]
    },
    "capabilityOutcome": "ACCEPTED_READ_ONLY_WITH_LIMITATIONS",
    "closureRecommendation": "CLOSE_DETERMINISTIC_CAPABILITY",
    "aiModelImplemented": false
  },
  "summary": {
    "canonicalSessions": 26,
    "provenanceEligible": 0,
    "humanDecisionReceipts": 0,
    "executionEvidence": 0,
    "uncorrelatedProcessingSources": 2,
    "targetDistribution": [
      {
        "target": "LDN 1320",
        "count": 3
      },
      {
        "target": "M 27",
        "count": 16
      },
      {
        "target": "NGC 281",
        "count": 5
      },
      {
        "target": "UNKNOWN",
        "count": 2
      }